Dynamic projection mapping onto non-rigid objects using markers and skeletal information,https://www.spiedigitallibrary.org/conference-proceedings-of-spie/12592/125922H/Dynamic-projection-mapping-onto-non-rigid-objects-using-markers-and/10.1117/12.2666971.short
LCD masks for spatial augmented reality,https://www.spiedigitallibrary.org/conference-proceedings-of-spie/9011/90110O/LCD-masks-for-spatial-augmented-reality/10.1117/12.2035091.short
Mosart: Mobile spatial augmented reality for 3d interaction with tangible objects,https://www.frontiersin.org/articles/10.3389/frobt.2018.00093/full
Pose estimation using object contour and projection distortion for dynamic projection mapping,https://www.spiedigitallibrary.org/conference-proceedings-of-spie/12177/121771O/Pose-estimation-using-object-contour-and-projection-distortion-for-dynamic/10.1117/12.2624669.short
Robust Blending and Occlusion Compensation in Dynamic Multi-Projection Mapping.,https://diglib.eg.org/xmlui/bitstream/handle/10.2312/egsh20171000/001-004.pdf?sequence=1&isAllowed=y
Spatial augmented reality on industrial CNC-machines,https://www.spiedigitallibrary.org/conference-proceedings-of-spie/6804/680409/Spatial-augmented-reality-on-industrial-CNC-machines/10.1117/12.760960.short
"Taste in Motion: the Effect of Projection Mapping of a Boiling Effect on Food Expectation, Food Perception, and Purchasing Behavior",https://www.frontiersin.org/articles/10.3389/fcomp.2021.662824/full
